11:13:32.408886 IP 10.244.1.5.39487 > dns.google.domain: Flags [S], seq 3583083735, win 64660, options [mss 1220,sackOK,TS val 3928321450 ecr 0,nop,wscale 7], length 0
11:13:33.756586 IP 10.244.1.5.37911 > dns.google.domain: Flags [S], seq 3968625706, win 64660, options [mss 1220,sackOK,TS val 3928322799 ecr 0,nop,wscale 7], length 0
11:13:34.789435 IP 10.244.1.5.37911 > dns.google.domain: Flags [S], seq 3968625706, win 64660, options [mss 1220,sackOK,TS val 3928323832 ecr 0,nop,wscale 7], length 0
11:13:37.916734 IP 10.244.1.5.46563 > dns.google.domain: Flags [S], seq 3852387807, win 64660, options [mss 1220,sackOK,TS val 3928326959 ecr 0,nop,wscale 7], length 0
11:13:38.949275 IP 10.244.1.5.46563 > dns.google.domain: Flags [S], seq 3852387807, win 64660, options [mss 1220,sackOK,TS val 3928327992 ecr 0,nop,wscale 7], length 0
